Moving Beyond the Banks: Hyporheic Restoration Is Fundamental to Restoring Ecological Services and Functions of Streams,"ET Hester, MN Gooseff",pdf,"Hester, E. T., & Gooseff, M. N. (2010). Moving beyond the banks: Hyporheic restoration is fundamental to restoring ecological services and functions of streams.",https://pubs.acs.org/doi/10.1021/es902988n,2010,"The hyporheic zone can be thought of as the foundation of a stream or river: it is the hydrologically connected region directly below the bed and extends beyond the banks. Exchange of water, nutrients, heat, and organisms between this subterranean zone and the water column above is crucial to the ecosystem's overall health. Therefore ecosystem restoration efforts that fail to take the hyporheic zone into account can fail to achieve their goals.",ACS,pubs.acs.org,,-,X,X,l,l,-,-,-,-,-,-,-,-,-,-,-,-,-,-,-,-,-,-,-,-,-,-,-,-,-,-,-,-,-,-,-,-,-,-,-,-,-
"National Large Wood Manual: Assessment, Planning, Design, and Maintenance of Large Wood in Fluvial Ecosystems: Restoring Process, Function, and Structure (USBR)","USBR, USACE",pdf,"Bureau of Reclamation and U.S. Army Corps of Engineers. 2015. National Large Wood Manual: Assessment, Planning, Design, and Maintenance of Large Wood in Fluvial Ecosystems: Restoring Process, Function, and Structure. 628 pages + Appendix. Available: www.usbr.gov/pn/.",https://www.usbr.gov/research/projects/detail.cfm?id=2754,2016,"This national manual provides a basic understanding of the role of wood in fluvial aquatic and riparian ecosystems and how it should be maintained, reintroduced, and/or managed. It highlights the best available science, creative engineering, and policies associated with restoring wood in rivers and streams as well as underscores the significance of wood in fluvial ecosystems.",USBR,usbr.gov,,-,X,X,-,-,-,-,X,X,X,-,-,-,-,-,-,-,-,-,X,-,-,-,-,-,X,-,-,-,-,-,-,-,X,X,X,-,-,-,-,-,X
National Stream and Aquatic Ecology Center,USFS,website,"USFS NSAEC. 2022, January 3.  National Stream & Aquatic Ecology Center Website. USDA USFA. https://www.fs.usda.gov/biology/nsaec/",https://www.fs.usda.gov/biology/nsaec/index.html,2020,"The focus of the National Stream and Aquatic Ecology Center is on developing tools and science applications for the more effective management and conservation of watersheds, streams, riparian ecosystems, fisheries and aquatic ecosystems on National Forests and Grasslands.",USFS NSAEC,fs.usda.gov,X,-,-,-,-,-,-,X,X,X,X,-,-,-,-,-,-,-,-,-,X,-,-,X,-,-,X,-,-,-,-,-,-,-,X,X,X,-,-,-,-,-,X
Natural Channel Design Review Checklist,RR Starr,pdf,"Starr, R. R. (2008). Natural Channel Design Review Checklist.",https://semspub.epa.gov/work/01/554351.pdf,2016,"This document presents a brief description of the checklist items by the following sections: Watershed and Geomorphic Assessment, Preliminary Design, Final Design, and Maintenance and Monitoring Plans. The checklist only includes items that relate to creating a stable channel using natural channel design methodologies. Therefore, other restoration tasks such as permitting, flood studies, construction methods and documents, and other items not directly related to creating a stable channel design are not included in the checklist.",EPA,epa.gov,,-,-,-,-,-,-,X,X,-,-,-,-,-,-,X,-,-,-,-,-,-,-,-,-,-,-,-,-,-,-,-,-,-,-,-,-,-,-,-,-,-,-
NEH - Part 630 - Hydrology,NRCS,pdf,"NRCS, USDA. (2004). National engineering handbook: Part 630—hydrology. USDA Soil Conservation Service: Washington, DC, USA, 11-5.",https://www.nrcs.usda.gov/wps/portal/nrcs/detailfull/national/water/?cid=stelprdb1043063,2009,"Each major kind of hydrologic problem is described, and, where possible, alternative solutions are given and their relative merits are briefly considered. Descriptive material is kept to a minimum. All equations and examples are numbered for ease of reference.",NRCS,usda.gov,,X,-,-,-,-,-,X,-,-,-,-,-,-,-,-,-,-,-,-,-,-,-,-,-,-,-,-,-,-,-,-,-,-,-,-,-,-,-,-,-,-,-
NEH - Part 654 - Stream Restoration Design,NRCS,pdf,"NRCS, USDA. (2007). National engineering handbook, part 654. Stream restoration design.",https://directives.sc.egov.usda.gov/viewerFS.aspx?hid=21433,2007,"This chapter provides an overview of processes important to stream corridors and their ecosystems. Stream corridors include the stream channel, riparian zone, and flood plains (level areas near the channel, formed by the stream and flooded during moderate-to-high flow events). Stream corridor features are shaped by the forces of flowing water, which depend on local topography and geological characteristics.",NRCS,usda.gov,,X,X,X,X,X,X,X,X,X,X,X,X,X,X,X,X,X,X,-,-,-,-,-,-,-,-,-,-,-,-,-,-,-,-,-,-,-,-,-,-,-,-
NEH 650 - Field Engineering Handbook,NRCS,pdf,"NRCS, USDA. NEH, Part 650, Engineering Field Handbook. Washington, DC.",https://directives.sc.egov.usda.gov/viewerFS.aspx?hid=21429,2021,Supplemental materials for hydrologic and hydraulic analyses,NRCS,usda.gov,,X,X,X,-,-,-,X,X,X,X,-,-,-,-,-,-,-,-,-,-,-,-,-,-,-,-,-,-,-,-,-,-,-,-,-,-,-,-,-,-,-,-
NEH- Part 653 - Stream Corridor Restoration Handbook,NRCS,pdf,"Federal Interagency Stream Restoration Working Group (US). (1998). Stream corridor restoration: Principles, processes, and practices. National Technical Info Svc.",https://directives.sc.egov.usda.gov/viewerFS.aspx?hid=34826,1998,"The document has been divided into three principal parts. Part I provides background on the fundamental concepts of stream corridor structure, processes, functions, and the effects of disturbance. Part II focuses on a general restoration plan development process comprised of several fundamental steps. Part III examines the information presented in Parts I and II to consider how it can be applied in a restoration initiative.",NRCS,usda.gov,,X,X,X,X,X,X,X,X,X,X,X,X,X,X,X,X,X,X,-,-,-,-,-,-,-,-,-,-,-,-,-,-,-,-,-,-,-,-,-,-,-,-
Open Channel Flow,FM Henderson,book,"Henderson, F. M. (1996). Open channel flow.",https://espace.library.uq.edu.au/view/UQ:344562,1966,"Open channel flow, like any topic of engineering interest, is defined and classified partly by its possession of certain characteristic applications and partly by the principles that are invoked to deal with them.",UQ,library.uq.edu.au,,-,X,-,-,-,-,-,-,-,-,-,-,-,-,-,-,-,-,-,-,-,-,-,-,-,-,-,-,-,-,-,-,-,-,-,-,-,-,-,-,-,-
Open-Channel Hydraulics,VT Chow,book,"Chow, V. T. (1959). Open-channel hydraulics. Caldwell.",https://www.google.com/books/edition/Open_channel_Hydraulics/OwZSAAAAMAAJ?hl=en,1959,"Open-Channel Hydraulics, originally published in 1959, has been described as one of the best textbooks ever written. It's clear descriptions of timeless fundamental principles make Chow a classic.",Blackburn,books.google.com,,-,X,-,-,-,-,-,-,-,-,-,-,-,-,-,-,-,-,-,-,-,-,-,-,-,-,-,-,-,-,-,-,-,-,-,-,-,-,-,-,-,-
Pebble Count,MG Wolman,pdf,"Wolman, M. G. (1954). A method of sampling coarse river?bed material. EOS, Transactions American Geophysical Union, 35(6), 951-956.",https://agupubs.onlinelibrary.wiley.com/doi/abs/10.1029/TR035i006p00951,1954,This determination of the size of material on the bed of a stream is based upon an analysis of the relative area covered by particles of given sizes. The method is applicable to those rivers which flow on coarse material and may be waded during periods of low water.,AGU,agupubs.onlinelibrary.wiley.com,,-,-,-,-,-,-,-,-,X,X,-,-,-,-,-,-,-,-,-,-,-,-,-,-,-,-,-,-,-,-,-,-,-,-,-,-,-,-,-,-,-,-
Photographic Guidance for Selecting Flow Resistance Coefficients in High-Gradient Channels,"SE Yochum, F Comiti, E Wohl, GC David, L Mao",pdf,"Yochum, S. E., Comiti, F., Wohl, E., David, G. C., & Mao, L. (2014). Photographic guidance for selecting flow resistance coefficients in high-gradient channels. USDA Forest Service-General Technical Report RMRS-GTR, 1-91.",https://www.fs.usda.gov/biology/nsaec/products-publications-gentechreports.html,2014,"Photographic guidance is presented to assist with the estimation of Manning'sn and Darcy- Weisbach f in high-gradient plane-bed, step-pool, and cascade channels. Reaches both with and without instream wood are included. These coefficients are necessary for the estimation of reachaverage velocity, energy loss, and discharge.",USFS,fs.usda.gov,,-,X,-,-,-,-,-,X,-,-,-,-,-,-,-,-,-,-,-,-,-,-,-,-,-,-,-,-,-,-,-,-,-,-,-,-,-,-,-,-,-,-
Recommendations of the Expert Panel to Define Removal Rates for Individual Stream Restoration Projects (Center for Watershed Protection),"J Berg, J Burch, D Capuccitti, S Filoso, et al.",pdf,"Berg, J., Burch, J., Capuccitti, D., Filoso, S., Fraley-McNeal, L., Goerman, D. & Winters, J. (2016). Recommendations of the expert panel to define removal rates for individual stream restoration projects.",https://owl.cwp.org/mdocs-posts/final-recommendations-of-the-expert-panel-to-define-removal-rates-for-individual-stream-restoration-projects/,2016,The Chesapeake Bay Program (CBP) panel of experts on the practice of urban stream restoration have defined 3 different protocols for achieving pollutant reductions through ”stream restoration”. Localities can get credit toward meeting their TMDL objectives through stream restoration practices that prevent channel erosion and implement design features.,CWP,owl.cwp.org,,-,-,-,X,-,-,-,-,-,-,X,-,-,X,X,-,-,-,-,-,-,-,-,-,-,-,-,-,-,X,X,-,-,-,-,-,-,-,-,X,X,X
Regenerative Storm Conveyance Design Review Checklist,"R Starr, W Harman",pdf,"Starr, R., W. Harman. 2015. Regenerative Storm Conveyance Design Review Checklist Version 3. U.S. Fish and Wildlife Service, Chesapeake Bay Field Office, Annapolis, MD. CBFO-S15-04. ",https://stream-mechanics.com/wp-content/uploads/2012/01/Regenerative-Storm-Conveyance-Design.pdf,2015,"The U.S. Fish and Wildlife Service – Chesapeake Bay Field Office (Service) has entered into a partnership with the Maryland Department of Environment (MDE), and Maryland State Highway Administration (SHA) to update the Natural Channel Design Review Checklist (NCD V3) and develop three new design checklists. The three new checklists include: analytical design (AD), valley restoration design (VRD), and regenerative storm conveyance design (RSCD). The development of new checklists is based on the request from MDE to provide review checklists for commonly used design approaches in Maryland.",USFWS CBFO,stream-mechanics.com,,-,-,-,-,-,-,-,-,-,-,-,-,-,-,-,-,-,-,-,X,-,-,-,-,-,-,-,-,-,-,-,-,-,-,X,-,-,-,-,-,X,-
Regenerative Stormwater Conveyance Design,Anne Arundel County,website,"Anne Arundel County MD Department of Public Works. 2022, January 3. Step Pool Conveyance Systems.  AA County.  https://www.aacounty.org/departments/public-works/wprp/restoration/step-pool-conveyance-systems/",https://www.aacounty.org/departments/public-works/wprp/watershed-assessment-and-planning/step-pool-conveyance-systems/,2022,"Step Pool Stormwater Conveyance Systems (SPSCs) are open-channel conveyance structures that convert, through attenuation ponds and a sand seepage filter, surface storm flow to shallow groundwater flow.  These systems safely convey, attenuate, and treat the quality of storm flow.  These structures utilize a series of constructed shallow aquatic pools, riffle grade control, native vegetation, and an underlying sand/woodchip mix filter bed media.",Anne Arundel County MD,aacounty.org,,-,-,-,-,-,-,-,-,-,-,-,-,-,-,-,X,-,-,-,X,-,-,-,-,-,-,-,-,-,-,-,-,-,-,X,-,-,-,-,-,X,-
Regional Hydraulic Geometry Curves,W Harman,website,W. Harman. 2015. Hydraulic Regional Curves for Selected Areas of the United States. EPA ,https://www.epa.gov/sites/default/files/2015-08/documents/appendix-a_hydraulic_regional_curves.pdf,2015,Hydraulic Regional Curves for Selected Areas of the United States,EPA,epa.gov,X,X,-,-,-,-,-,X,-,-,-,-,-,X,X,X,-,-,-,-,-,-,-,-,-,-,-,-,-,-,-,-,-,-,-,-,-,-,-,-,-,-,-
Regional Regressions by State,USGS,website,USGS National Streamflow Statistics Program. 2022 January 3. Regional Regression Equation Publications by State. USGS. https://water.usgs.gov/osw/programs/nss/pubs.html,https://water.usgs.gov/osw/programs/nss/pubs.html,2022,Regional Regression Equation Publications by State at this website hosted by the USGS.  It included regional regressions and hydraulic geometry regressions as well.,USGS,water.usgs.gov,X,X,-,-,-,-,-,X,-,-,-,-,-,X,-,-,-,-,-,-,-,-,-,-,-,-,-,-,-,-,-,-,-,-,-,-,-,-,-,-,-,-,-
River Restoration Toolbox,Iowa Department of Natural Resrouces,website,"Iowa DNR's River Restoration Toolbox. 2022, January 3. River Restoration Toolbox. Iowa DNR. https://www.iowadnr.gov/Environmental-Protection/Water-Quality/River-Restoration/River-Restoration-Toolbox",https://www.iowadnr.gov/Environmental-Protection/Water-Quality/River-Restoration/River-Restoration-Toolbox,2022,"Iowa’s River Restoration Toolbox is a series of best management practices developed to assist designers in stream stabilization and restoration projects in Iowa with proven techniques with emphasis on incorporating natural materials, such as logs, stone, and live plantings.",Iowa DNR,iowadnr.gov,,-,-,-,-,-,-,X,X,X,X,-,-,-,X,X,X,-,-,X,X,X,X,X,X,-,X,-,-,X,X,X,-,-,-,X,X,-,-,-,-,-,X
Rosgen Natural Channel Design,NRCS,pdf,"NRCS, USDA. (2007). NEH 654 Chapter 11, Stream Restoration Design Guide, Rosgen Natural Channel Design. NRCS National Engineering Handbook.",https://semspub.epa.gov/work/01/557060.pdf,2007,"Natural channel design using the Rosgen geomorphic channel design approach incorporates a combination of analog, empirical, and analytical methods for assessment and design. Because all rivers within a wide range of valley types do not exhibit similar morphological, sedimentological, hydraulic",NRCS,semspub.epa.gov,,-,-,-,-,-,-,-,-,-,-,-,-,-,X,-,-,-,-,-,X,X,-,-,X,-,X,-,-,-,X,X,-,-,X,X,X,-,-,-,-,-,X
Rosgen Natural Channel Design Checklist,"W Harman, R Starr",pdf,"Harman, W., R. Starr. 2011. Natural Channel Design Review Checklist. US Fish and Wildlife Service, Chesapeake Bay Field Office, Annapolis, MD and US Environmental Protection Agency, Office of Wetlands, Oceans, and Watersheds, Wetlands Division. Washington, D.C. EPA 843-B-12-005",https://www.epa.gov/sites/default/files/2015-07/documents/ncd_review_checklist.pdf,2015,Stream Mechanics and the US Fish and Wildlife Service — Chesapeake Bay Field Office (Service) have produced a Version 2 of The Natural Channel Design Review Checklist. The Checklist and supporting document was funded through a cooperative agreement between the Environmental Protection Agency — Wetlands Division (EPA) and the Service.,USFWS CBFO,epa.gov,,-,-,-,-,-,-,X,X,X,X,-,-,-,X,-,-,-,-,-,-,-,-,-,-,-,-,-,-,-,-,-,-,-,-,-,-,-,-,-,-,-,-
Roughness Characteristics of Natural Channels (Photographic Manning's N),HH Barnes,pdf,"Barnes, H. H. (1967). Roughness characteristics of natural channels (No. 1849). US Government Printing Office.",https://pubs.usgs.gov/wsp/wsp_1849/pdf/wsp_1849.pdf,1967,Classic text that contains photographs of rivers with calibrated manning's n values produced by the USGS.,USGS,pubs.usgs.gov,,-,X,-,-,-,-,-,X,-,-,-,-,-,-,-,-,-,-,-,-,-,-,-,-,-,-,-,-,-,-,-,-,-,-,-,-,-,-,-,-,-,-
Sampling Surface and Subsurface Particle-Size Distributions in Wadable Gravel-and Cobble-Bed Streams,K Bunte,pdf,"Bunte, K. (2001). Sampling surface and subsurface particle-size distributions in wadable gravel-and cobble-bed streams for analyses in sediment transport, hydraulics, and streambed monitoring. US Department of Agriculture, Forest Service, Rocky Mountain Research Station.",https://www.fs.usda.gov/treesearch/pubs/4580,2001,"This document provides guidance for sampling surface and subsurface sediment from wadable gravel-and cobble-bed streams. After a short introduction to streams types and classifications in gravel-bed rivers, the document explains the field and laboratory measurement of particle sizes and the statistical analysis of particle-size distributions. Analysis of particle parameters, including shape, density, and bulk density are also discussed.",USFS,fs.usda.gov,,-,-,X,-,-,-,-,-,X,X,-,-,-,-,-,-,-,-,-,-,-,-,-,-,-,-,-,-,-,-,-,-,-,-,-,-,-,-,-,-,-,-
"Science base and tools for evaluating stream engineering, management, and restoration proposals","PB Skidmore, CR Thorne, BL Cluer, GR Pess, JM Castro",website,"Skidmore, P. B., Thorne, C. R., Cluer, B. L., Pess, G. R., Castro, J. M., Beechie, T. J., & Shea, C. C. (2011). Science base and tools for evaluating stream engineering, management, and restoration proposals.",https://repository.library.noaa.gov/view/noaa/4020,2011,"Training in the use of RiverRAT was developed parallel to writing of this document, and training sessions for reviewers begin with a presentation on watershed and stream processes as they relate to river habitat. Additionally, the checklist and RiverRAT have built-in reporting features to facilitate efficient tracking and reporting back of project reviews",NOAA,repository.noaa.gov,X,-,X,X,-,-,-,-,X,X,X,-,-,-,-,-,-,-,-,-,-,-,-,-,-,-,-,-,-,-,-,-,-,-,-,-,-,-,-,-,-,-,-
Sediment Transfer Primer,"P Wilcock, J Pitlick, Y Cui",pdf,"Wilcock, P., Pitlick, J., & Cui, Y. (2009). Sediment transport primer: estimating bed-material transport in gravel-bed rivers. Gen. Tech. Rep. RMRS-GTR-226. Fort Collins, CO: US Department of Agriculture, Forest Service, Rocky Mountain Research Station. 78 p., 226.",https://www.fs.usda.gov/research/treesearch/32966,2009,"This primer accompanies the release of BAGS, software developed to calculate sediment transport rate in gravel-bed rivers. BAGS and other programs facilitate calculation and can reduce some errors, but cannot ensure that calculations are accurate or relevant. This primer was written to help the software user define relevant and tractable problems, select appropriate input, and interpret and apply the results in a useful and reliable fashion. It presents general concepts, develops the fundamentals of transport modeling, and examines sources of error. It introduces the data needed and evaluates different options based on the available data. Advanced expertise is not required.",USFS,fs.usda.gov,,-,X,X,-,-,-,-,X,X,-,-,-,-,-,-,-,X,X,-,-,-,-,-,-,-,-,-,-,-,-,-,-,-,-,-,-,-,-,-,-,-,-
"Sedimentation Engineering: Processes, Measurements, Modeling, and Practice",M Garcia,book,"Garcia, M. (2008, May). Sedimentation engineering: processes, measurements, modeling, and practice. American Society of Civil Engineers.",https://ascelibrary.org/doi/book/10.1061/9780784408148,2008,"Prepared by the ASCE Task Committee to Expand and Update Manual 54 of the Sedimentation Committee of the Environmental and Water Resources Institute of ASCE. Sedimentation Engineering: Processes, Measurements, Modeling, and Practice presents extensive advances in methods of investigation, measurement, and analysis in the specialized field of sedimentation engineering. A supplement to the classic Sedimentation Engineering (Manual 54), this new volume not only documents the evolution of the field over",ASCE,ascelibrary.org,X,-,X,X,-,-,-,-,X,X,X,-,-,X,-,X,X,X,X,-,X,X,-,-,X,-,-,-,-,-,-,-,X,-,-,X,X,-,-,-,-,-,X
Stability Thresholds for Stream Restoration Materials,JC Fischenich,pdf,"Fischenich, J. C. (2001). Stability thresholds for stream restoration materials.",https://erdc-library.erdc.dren.mil/jspui/handle/11681/3947,2001,"Stream restoration projects usually involve some modification to the channel or the banks. Designers of stabilization or restoration projects must ensure that the materials placed within the channel or on the banks will be stable for the full range of conditions expected during the design life of the project. Unfortunately, techniques to characterize stability thresholds are limited. Theoretical approaches do not exist and empirical data mainly consist of velocity limits, which are of limited value. Empirical data for shear stress or stream power are generally lacking, but the existing body of information is summarized in this technical note.",USACE ERDC,erdc-library.erdc.dren.mil,,-,-,X,-,-,-,-,-,X,X,-,-,-,-,-,X,-,-,-,-,-,-,-,-,-,-,-,-,-,-,-,-,-,-,-,-,-,-,-,-,-,-
Stream and Watershed Restoration: A Guide to Restoring Riverine Processes and Habitats,"P Roni, T Beechie",book,"Roni, P., & Beechie, T. (2013). Stream and watershed restoration: a guide to restoring riverine processes and habitats. Wiley-Blackwell.",https://onlinelibrary.wiley.com/doi/book/10.1002/9781118406618,2013,"With $2 billion spent annually on stream restoration worldwide, there is a pressing need for guidance in this area, but until now, there was no comprehensive text on the subject. Filling that void, this unique text covers both new and existing information following a stepwise approach on theory, planning, implementation, and evaluation methods for the restoration of stream habitats.",Wiley Online Library,onlinelibrary.wiley.com,X,X,X,X,X,X,X,X,X,X,X,X,X,-,-,-,-,-,-,X,X,-,-,X,X,-,X,X,-,X,X,X,X,-,-,-,-,-,-,-,-,-,-
Stream Functions Pyramid - A Function-Based Framework for Stream Assessment & Restoration Projects,W Harman,website,"Harman, W. 2022, January 3. Stream Functions Pyramid. Stream-Mechanics.  https://stream-mechanics.com/stream-functions-pyramid-framework/",https://stream-mechanics.com/stream-functions-pyramid-framework/,2012,This page includes a wide variety of information about the Stream Functions Pyramid Framework and its application. Check this page frequently for new versions of the Stream Quantification Tool and more.,stream-mechanics,stream-mechanics.com,X,X,X,X,X,X,X,X,X,X,X,X,X,-,-,-,-,-,-,-,-,-,-,-,-,-,-,-,-,-,-,-,-,-,-,-,-,-,-,-,-,-,-
Stream Habitat Restoration Guidelines,Washington FWS,pdf,"Cramer, M. L. (2012). Stream habitat restoration guidelines. Co-published by the Washington Departments of Fish and Wildlife. Natural Resources, Transportation and Ecology, Washington State Recreation and Conservation Office, Puget Sound Partnership, and the US Fish and Wildlife Service. Olympia, Washington.",https://wdfw.wa.gov/publications/01374,2012,"Few endeavors in resource and environmental management in the Pacific Northwest are more compelling than rapidly expanding efforts to restore the region's streams and rivers. The region's history and strongly held values are inseparably intertwined with our streams and rivers. In coastal and inland settings, historic and current settlement and development patterns have centered on streams for transportation, residential, municipal, agricultural, and industrial water supply, power generation, and crop irrigation. Pacific Northwest streams and rivers, and their floodplains provide; food, construction aggregates, and recreational opportunities. Their floodplains provide relatively flat, fertile agricultural land and their forested riparian zones historically supplied timber. However, competing uses of stream corridors in modern society, combined with large-scale alteration of watersheds, have directly and indirectly impacted the abundance, quality, and stability of stream and riparian habitats.",,wdfw.wa.gov,X,X,X,X,X,X,X,X,X,X,X,X,X,-,-,X,-,-,-,X,X,-,-,X,-,-,X,X,-,X,-,X,X,-,X,-,-,-,-,-,-,-,X
Stream Mechanics Resources,W Harman,website,"Stream Mechanics.  2022, January 3. Stream Mechanics Resources. Stream Mechanics. https://stream-mechanics.com/resources/",https://stream-mechanics.com/resources/,2022,"A wide range of information is provided on this page, including:  guidance documents, tools, presentations, links to other web pages, favorite books, etc. We will continue to update this page as additional guidance and tools become available. ",Stream Mechanics,stream-mechanics.com,,X,X,X,-,-,-,X,X,X,-,-,-,-,-,-,-,-,-,-,-,-,-,-,-,-,-,-,-,-,-,-,-,-,-,-,-,-,-,-,-,-,-
"Stream modules: Spreadsheet tools for river evaluation, assessment and monitoring","G Powell, DE Mecklenburg, AD Ward",pdf,"Powell, G. E., Mecklenburg, D. E., & Ward, A. D. (2006). Spreadsheet tools for river evaluation, assessment, and monitoring: The STREAM diagnostic modules. In World Environmental and Water Resource Congress 2006: Examining the Confluence of Environmental and Water Concerns (pp. 1-12).",https://ascelibrary.org/doi/10.1061/40856%28200%29349,2006,"Stream physical condition is increasingly a priority for resource managers. Assessment, monitoring and restoration techniques continue to be developed and standardized. A suite of spreadsheet tools, the STREAM Modules, has been developed by the Ohio Department of Natural Resources and Ohio State University to meet the technical demand. This ongoing project began in 1998 and includes the following modules that are available at no cost: (1) Reference Reach Spreadsheet for reducing channel survey data and calculating basic bankfull hydraulic characteristics, (2) Regime Equations for determining the dimensions of typical channel form, (3) Meander Pattern that dimensions a simple arc and line best fit of the sine-generated curve, (4) Two-Stage Geometry that sizes a two-stage channel system based on regional curves and provides estimates of earthwork requirements to construct various two-stage geometries, ",ASCE,ascelibrary.org,,X,X,X,-,-,-,X,X,X,X,-,-,X,X,X,-,-,-,-,-,-,-,-,-,-,-,-,-,-,-,-,-,-,-,-,-,-,-,-,-,-,-
