"Stream Restoration in Dynamic Fluvial Systems: Scientific Approaches, Analyses, and Tools","SJ Bennett, JM Castro, A Simon",book,"Bennett, S. J., Castro, J. M., & Simon, A. (Eds.). (2013). Stream restoration in dynamic fluvial systems: Scientific approaches, analyses, and tools. John Wiley & Sons.",https://agupubs.onlinelibrary.wiley.com/doi/book/10.1029/GM194,2011,"Stream Restoration in Dynamic Fluvial Systems: Scientific Approaches, Analyses, and Tools brings together leading contributors in stream restoration science to provide comprehensive consideration of process-based approaches, tools, and applications of techniques useful for the implementation of sustainable restoration strategies. Stream restoration is a catchall term for modifications to streams and adjacent riparian zones undertaken to improve geomorphic and/or ecologic function, structure, and integrity of river corridors, and it has become a multibillion dollar industry.",AGU,agupubs.onlinelibrary.wiley.com,X,X,X,X,-,-,-,X,X,X,X,-,-,-,-,-,-,-,-,-,-,-,-,-,-,-,-,-,-,-,-,-,-,-,-,-,-,-,-,-,-,-,-
Stream Stability at Highway Structures,"PF Lagasse, LW Zevenbergen, W Spitz, LA Arneson",book,"Lagasse, P. F., Zevenbergen, L. W., Spitz, W., & Arneson, L. A. (2012). Stream stability at highway structures (No. FHWA-HIF-12-004). United States. Federal Highway Administration. Office of Bridge Technology.",https://www.fhwa.dot.gov/engineering/hydraulics/library_arc.cfm?pub_number=19&id=152,2012,"This document provides guidelines for identifying stream instability problems at highway stream crossings. It is an update of the third edition published in 2001. The HEC-20 manual covers geomorphic and hydraulic factors that affect stream stability and provides a step-by-step analysis procedure for evaluation of stream stability problems. Stream channel classification, stream reconnaissance techniques, and rapid assessment methods for channel stability are covered in detail. ",FHA,fhwa.dot.gov,,-,X,X,-,-,-,-,X,X,X,-,-,-,-,X,X,X,X,-,X,X,-,X,-,-,X,X,-,-,-,-,X,-,-,X,X,-,-,-,-,-,X
Streams and Ground Waters (Aquatic Ecology),"JB Jones, PJ Mulholland",book,"Jones, J. B., & Mulholland, P. J. (1999). Streams and ground waters. Elsevier.",https://www.sciencedirect.com/book/9780123898456/streams-and-ground-waters,1999,"Streams around the world flow toward the sea in floodplains. All along this transit, there is exchange of water between the stream itself and the surrounding sediments which form the floodplain. Many chemical, biological, and geological processes occur when water moves back and forth between streams and these flood plain sediments. Streams and Groundwaters focuses on the consequences of water flow between streams, their underlying sediments, and surrounding landscapes. ",Elsevier,sciencedirect.com,,-,X,X,X,X,-,-,X,-,X,X,X,-,-,-,-,-,-,-,-,-,-,-,-,-,-,X,-,X,-,X,-,-,-,-,-,-,-,-,-,-,-
Synthesizing U.S. River Restoration Efforts,"ES Bernhardt, MA Palmer, JD Allan, G Alexander, K Barnas",pdf,"Bernhardt, E. S., Palmer, M. A., Allan, J. D., Alexander, G., Barnas, K., Brooks, S., ... & Sudduth, E. (2005). Synthesizing US river restoration efforts. Science, 308(5722), 636-637.",https://www.science.org/doi/abs/10.1126/science.1109769,2005,"We began by compiling data on restoration projects from 18 national coverage databases maintained by federal agencies (b), but found that the majority of projects are recorded only at the regional or local level. A large number of municipal, state and regional databases are being developed, but we found few extensive databases (b) of river restoration [average no. of project records per data source was 51 ± 26 (95%CI)] (this does not include personal contacts which on average yielded information on six projects). ",Science,science.org,,-,-,-,-,-,X,-,-,-,-,-,-,-,-,-,-,-,-,-,-,-,-,-,-,-,-,-,-,-,-,-,-,-,-,-,-,-,-,-,-,-,-
Technical Guide for Field Practitioners: Understanding and Monitoring Aquatic Organism Passage at Road Stream Crossings,"N Heredia, B Roper, N Gillespie, C Roghair",book,"Heredia, N., Roper, B., Gillespie, N., & Roghair, C. (2016). Technical Guide for Field Practitioners: Understanding and Monitoring Aquatic Organism Passage at Road-Stream Crossings. US Department of Agriculture, Forest Service, National Stream and Aquatic Ecology Center, Technical Report TR-101.",https://www.researchgate.net/profile/Nathaniel-Gillespie/publication/277430574_Distribution_Status_and_Land_Use_Characteristics_of_Subwatersheds_within_the_Native_Range_of_Brook_Trout_in_the_Eastern_United_States/links/57e2a06c08aeb5afc1d05fa9/Distribution-Status-and-Land-Use-Characteristics-of-Subwatersheds-within-the-Native-Range-of-Brook-Trout-in-the-Eastern-United-States.pdf,2016,"The USFS manages approximately 370,000 miles of roads and replaces between 150-300 road-stream crossings annually, indicating a need for prioritizing restoration projects. While not specific to USFS land, a study of road-stream crossings in the Great Lakes region indicated that only 36% of locations were fully passable by fish (Januchowski-Hartley et al. 2013). Past USFS road-stream crossing remediation efforts have produced varying degrees of success, as measured by newly available habitat per dollar spent.",USFS,researchgate.net,,-,X,X,-,X,-,-,X,-,X,X,-,-,-,X,-,-,-,-,-,-,-,X,-,-,-,-,-,-,-,-,-,-,-,-,-,-,-,-,-,-,-
The Legend of A. F. Shields,JM Buffington,pdf,"Buffington, J. M. (1999). The legend of AF Shields. Journal of Hydraulic Engineering, 125(4), 376-387.",https://ascelibrary.org/doi/10.1061/%28ASCE%290733-9429%281999%29125%3A4%28376%29,1999,"The well-known doctoral work of Shields is a tale that is frequently recounted by many authors and has spawned a large, continuing body of research over the last 60 years. Despite the success of Shields' work, the details of his experimental methods and results as reported by others are quite variable. Inconsistencies and misconceptions regarding Shields' work are identified and examined here. Incomplete descriptions by Shields, loss of his original data, and Shields' postgraduate absence from the hydraulic engineering community leave some of the identified inconsistencies open to debate.",Journal of Hydraulic Engineering,ascelibrary.org,,-,-,X,-,-,-,-,-,-,-,-,-,-,-,-,-,-,-,-,-,-,-,-,-,-,-,-,-,-,-,-,-,-,-,-,-,-,-,-,-,-,-
Tools in Fluvial Geomorphology,Kondolf,book,"Kondolf, G. M., & Piégay, H. (Eds.). (2016). Tools in fluvial geomorphology (p. 171). Chichester, UK: John Wiley & Sons.",https://www.wiley.com/en-us/Tools+in+Fluvial+Geomorphology%2C+2nd+Edition-p-9780470684054,2016,In recent years there has been a marked increase in funding and employment in river restoration. Methods in Fluvial Geomorphology provides an integrated approach to the interdisciplinary nature of the subject and offers guidance for researchers and professionals on the tools available to answer questions on river management on very difference scales.,Wiley,onlinelibrary.wiley.com,,-,-,X,-,-,-,-,-,X,X,-,-,-,-,-,-,-,-,-,-,-,-,-,-,-,-,-,-,-,-,-,-,-,-,-,-,-,-,-,-,-,-
TR-55 Watershed Hydrology,RG Cronshey,pdf,"Cronshey, R. (1986). Urban hydrology for small watersheds. US Dept. of Agriculture, Soil Conservation Service, Engineering Division.",https://tamug-ir.tdl.org/handle/1969.3/24438,1986,"A microcomputer program is being prepared for the upcoming revision of the Soil Conservation Service's 'Urban Hydrology for Small Watersheds,' Technical Release Number 55 (TR-55). TR-55 presents methods for computing runoff volume and peak rates of discharge in urban and urbanizing areas. The program will be written in BASIC to run under MS-DOS. Features include modular design, user-oriented input, HELP screens, special function keys, and user defined data files.",NRCS,tamug-ir.tdl.org,,X,-,-,-,-,-,X,-,-,-,-,-,-,-,-,-,-,-,-,-,-,-,-,-,-,-,-,-,-,-,-,-,-,-,-,-,-,-,-,-,-,-
Watershed Assessment of River Stability and Sediment Supply,DL Rosgen,book,"Rosgen, D. L. (2009). Watershed assessment of river stability and sediment supply (WARSSS). Wildland Hydrology.",https://www.google.com/books/edition/Watershed_Assessment_of_River_Stability/fgL3SAAACAAJ?hl=en,2009,"A geomorphology-based procedure to quantify the effects of land uses on sediment relations and channel stability. Implements a three-phase assessment to quickly identify processes and land uses responsible for erosion, channel instability and disproportionate sediment supply; provides a cumulative watershed impact analysis to prioritize mitigation; assesses watershed condition needed for river restoration planning and design; developed in partnership with the USEPA for national application for impaired rivers; includes a CD-ROM of worksheets.",Wildland Hydrology,books.google.com,,-,X,X,-,-,-,-,X,X,X,-,-,-,X,X,X,-,-,-,-,-,-,-,-,-,-,-,-,-,-,-,-,-,-,-,-,-,-,-,-,-,-
